{
  "metadata": {
    "version": "1.0.0",
    "schemaVersion": "1.0.0",
    "repositoryVersion": "1.0.0",
    "status": "Published",
    "reviewState": "Approved",
    "createdAt": "2026-07-11T00:00:00Z",
    "updatedAt": "2026-07-11T00:00:00Z",
    "createdBy": [
      {
        "type": "Automation",
        "name": "Codex",
        "role": "Registry author"
      }
    ],
    "license": "Apache-2.0",
    "language": "en",
    "provenance": {
      "source": "Canonical RKM architecture documentation",
      "sourceFiles": [
        "docs/architecture/relationship-model.md",
        "docs/architecture/ubiquitous-language.md"
      ]
    }
  },
  "ontologyVersion": "1.0.0",
  "relationshipTypes": [
    {
      "type": "EXTENDS",
      "label": "Extends",
      "description": "Indicates that the source entity builds upon the target entity while preserving its core idea.",
      "category": "Structural",
      "canonicalDirection": {
        "sourceRole": "extending entity",
        "targetRole": "extended entity",
        "description": "The source builds upon the target with additional capability or scope."
      },
      "allowedSources": [
        {
          "entityType": "Artifact",
          "includeSubtypes": true
        }
      ],
      "allowedTargets": [
        {
          "entityType": "Artifact",
          "includeSubtypes": true
        }
      ],
      "transitivity": "Transitive",
      "status": "Published",
      "stability": "Stable",
      "introducedInOntologyVersion": "1.0.0"
    },
    {
      "type": "SPECIALIZES",
      "label": "Specializes",
      "description": "Indicates that the source entity is a more specific form of the target entity.",
      "category": "Structural",
      "canonicalDirection": {
        "sourceRole": "specific entity",
        "targetRole": "general entity",
        "description": "The source narrows or specializes the concept represented by the target."
      },
      "allowedSources": [
        {
          "entityType": "Artifact",
          "includeSubtypes": true
        }
      ],
      "allowedTargets": [
        {
          "entityType": "Artifact",
          "includeSubtypes": true
        }
      ],
      "inverse": {
        "type": "GENERALIZES",
        "storage": "Derived",
        "description": "The inverse states that the target generalizes the source."
      },
      "transitivity": "Transitive",
      "status": "Published",
      "stability": "Stable",
      "introducedInOntologyVersion": "1.0.0"
    },
    {
      "type": "GENERALIZES",
      "label": "Generalizes",
      "description": "Indicates that the source entity is a broader abstraction of the target entity.",
      "category": "Structural",
      "canonicalDirection": {
        "sourceRole": "general entity",
        "targetRole": "specific entity",
        "description": "The source abstracts over the more specific target entity."
      },
      "allowedSources": [
        {
          "entityType": "Artifact",
          "includeSubtypes": true
        }
      ],
      "allowedTargets": [
        {
          "entityType": "Artifact",
          "includeSubtypes": true
        }
      ],
      "inverse": {
        "type": "SPECIALIZES",
        "storage": "Derived",
        "description": "The inverse states that the target specializes the source."
      },
      "transitivity": "Transitive",
      "status": "Published",
      "stability": "Stable",
      "introducedInOntologyVersion": "1.0.0"
    },
    {
      "type": "BELONGS_TO",
      "label": "Belongs To",
      "description": "Indicates that the source entity is a member of the target taxonomy, family, or category.",
      "category": "Structural",
      "canonicalDirection": {
        "sourceRole": "member entity",
        "targetRole": "category entity",
        "description": "The source is classified as belonging to the target category."
      },
      "allowedSources": [
        {
          "entityType": "Artifact",
          "includeSubtypes": true
        }
      ],
      "allowedTargets": [
        {
          "entityType": "Artifact",
          "includeSubtypes": true
        }
      ],
      "transitivity": "Transitive",
      "status": "Published",
      "stability": "Stable",
      "introducedInOntologyVersion": "1.0.0"
    },
    {
      "type": "PART_OF",
      "label": "Part Of",
      "description": "Indicates that the source entity is a component, step, or member part of the target entity.",
      "category": "Structural",
      "canonicalDirection": {
        "sourceRole": "part entity",
        "targetRole": "whole entity",
        "description": "The source is contained within or composes part of the target."
      },
      "allowedSources": [
        {
          "entityType": "Artifact",
          "includeSubtypes": true
        }
      ],
      "allowedTargets": [
        {
          "entityType": "Artifact",
          "includeSubtypes": true
        }
      ],
      "inverse": {
        "type": "CONTAINS",
        "storage": "Derived",
        "description": "The inverse states that the target contains the source."
      },
      "transitivity": "Transitive",
      "status": "Published",
      "stability": "Stable",
      "introducedInOntologyVersion": "1.0.0"
    },
    {
      "type": "CONTAINS",
      "label": "Contains",
      "description": "Indicates that the source entity contains the target entity as a component, step, or member part.",
      "category": "Structural",
      "canonicalDirection": {
        "sourceRole": "whole entity",
        "targetRole": "part entity",
        "description": "The source contains the target as one of its constituent parts."
      },
      "allowedSources": [
        {
          "entityType": "Artifact",
          "includeSubtypes": true
        }
      ],
      "allowedTargets": [
        {
          "entityType": "Artifact",
          "includeSubtypes": true
        }
      ],
      "inverse": {
        "type": "PART_OF",
        "storage": "Derived",
        "description": "The inverse states that the target is part of the source."
      },
      "status": "Published",
      "stability": "Stable",
      "introducedInOntologyVersion": "1.0.0"
    },
    {
      "type": "REQUIRES",
      "label": "Requires",
      "description": "Indicates that the target entity is a mandatory dependency for the source entity to function as defined.",
      "category": "Dependency",
      "canonicalDirection": {
        "sourceRole": "requiring entity",
        "targetRole": "required dependency",
        "description": "The source requires the target as a necessary dependency."
      },
      "allowedSources": [
        {
          "entityType": "Artifact",
          "includeSubtypes": true
        }
      ],
      "allowedTargets": [
        {
          "entityType": "Artifact",
          "includeSubtypes": true
        }
      ],
      "status": "Published",
      "stability": "Stable",
      "introducedInOntologyVersion": "1.0.0"
    },
    {
      "type": "DEPENDS_ON",
      "label": "Depends On",
      "description": "Indicates a conceptual, operational, or indirect dependency from the source entity to the target entity.",
      "category": "Dependency",
      "canonicalDirection": {
        "sourceRole": "dependent entity",
        "targetRole": "dependency entity",
        "description": "The source depends on the target without necessarily making it mandatory."
      },
      "allowedSources": [
        {
          "entityType": "Artifact",
          "includeSubtypes": true
        }
      ],
      "allowedTargets": [
        {
          "entityType": "Artifact",
          "includeSubtypes": true
        }
      ],
      "status": "Published",
      "stability": "Stable",
      "introducedInOntologyVersion": "1.0.0"
    },
    {
      "type": "USES",
      "label": "Uses",
      "description": "Indicates that the source entity uses the target entity without specifying whether usage is mandatory.",
      "category": "Dependency",
      "canonicalDirection": {
        "sourceRole": "using entity",
        "targetRole": "used entity",
        "description": "The source uses the target as part of its behavior, design, or operation."
      },
      "allowedSources": [
        {
          "entityType": "Artifact",
          "includeSubtypes": true
        }
      ],
      "allowedTargets": [
        {
          "entityType": "Artifact",
          "includeSubtypes": true
        }
      ],
      "status": "Published",
      "stability": "Stable",
      "introducedInOntologyVersion": "1.0.0"
    },
    {
      "type": "OPTIONALLY_USES",
      "label": "Optionally Uses",
      "description": "Indicates that the source entity may optionally use the target entity without requiring it.",
      "category": "Dependency",
      "canonicalDirection": {
        "sourceRole": "optionally using entity",
        "targetRole": "optional dependency",
        "description": "The source can use the target, but the target is not mandatory."
      },
      "allowedSources": [
        {
          "entityType": "Artifact",
          "includeSubtypes": true
        }
      ],
      "allowedTargets": [
        {
          "entityType": "Artifact",
          "includeSubtypes": true
        }
      ],
      "status": "Published",
      "stability": "Stable",
      "introducedInOntologyVersion": "1.0.0"
    },
    {
      "type": "CONSUMES",
      "label": "Consumes",
      "description": "Indicates that the source entity receives or consumes the target entity as an input.",
      "category": "Dependency",
      "canonicalDirection": {
        "sourceRole": "consumer entity",
        "targetRole": "input entity",
        "description": "The source consumes the target as input during operation."
      },
      "allowedSources": [
        {
          "entityType": "Artifact",
          "includeSubtypes": true
        }
      ],
      "allowedTargets": [
        {
          "entityType": "Artifact",